{
  "schema_version": "1.0.0",
  "gate_name": "tdd-guide",
  "verdict": "PASS",
  "failure_class": "none",
  "confidence": 0.95,
  "model_used": "claude-sonnet-4-6",
  "tier": "sonnet",
  "timestamp": "2026-07-04T12:00:00Z",
  "summary": "Test committed before implementation, CI shows real RED then GREEN, boundary case covered.",
  "findings": [],
  "scope": {
    "branch": "feat/discounts",
    "commit": "b8b8b8b",
    "files_reviewed": ["modules/discounts.py", "tests/test_discounts.py"],
    "lines_reviewed": 12
  }
}
