{
  "schema_version": "1.0.0",
  "gate_name": "code-reviewer",
  "verdict": "PASS",
  "failure_class": "none",
  "confidence": 0.93,
  "model_used": "claude-sonnet-4-6",
  "tier": "sonnet",
  "timestamp": "2026-06-24T14:32:00Z",
  "summary": "Clean. 0 CRITICAL, 0 HIGH; 2 MEDIUM noted.",
  "findings": [
    {
      "severity": "MEDIUM",
      "rule": "function-too-long",
      "file": "modules/search/api.py",
      "line": 120,
      "message": "Function search_users is 78 lines; consider extraction.",
      "suggestion": "Split filter-building helper out of the main handler."
    }
  ],
  "scope": {
    "branch": "feat/search-improvements",
    "commit": "abc1234",
    "files_reviewed": ["modules/search/api.py"],
    "lines_reviewed": 142
  }
}
